{"acquisition_id":"beno-letter-to-the-roman-church-openmgh-acquired","edition_id":"beno-letter-to-the-roman-church-openmgh-electronic","provider":"Monumenta Germaniae Historica (openMGH)","retained_files":[{"bytes":1095819,"media_type":"application/zip","path":"raw/openmgh/bsb00000829/bsb00000829.zip","scope":"Original complete acquired openMGH archive.","sha256":"287bc95d5e4acf5378c381ae3646481882a71a03b60ddb4eaf46fa3c8ec59042"},{"bytes":3985065,"media_type":"application/tei+xml","path":"raw/openmgh/bsb00000829/tei/bsb00000829.xml","scope":"Extracted TEI XML raw/openmgh/bsb00000829/tei/bsb00000829.xml is the retained text source; ZIP raw/openmgh/bsb00000829/bsb00000829.zip is the acquisition package. existing work association locators: raw/openmgh/bsb00000829/tei/bsb00000829.xml#bsb00000829_00377_10; raw/openmgh/bsb00000829/tei/bsb00000829.xml#bsb00000829_00381_23. These locators are evidence for accounting, not an adopted complete child extraction or TEI acceptance.","sha256":"cb35385e4e4ba87f80a002452a527527866322af7ccea7f23f366735e46df989"}],"schema_version":"2.0","source_bytes":3985065,"source_path":"raw/openmgh/bsb00000829/tei/bsb00000829.xml","source_scope":"Extracted TEI XML raw/openmgh/bsb00000829/tei/bsb00000829.xml is the retained text source; ZIP raw/openmgh/bsb00000829/bsb00000829.zip is the acquisition package. existing work association locators: raw/openmgh/bsb00000829/tei/bsb00000829.xml#bsb00000829_00377_10; raw/openmgh/bsb00000829/tei/bsb00000829.xml#bsb00000829_00381_23. These locators are evidence for accounting, not an adopted complete child extraction or TEI acceptance.","source_sha256":"cb35385e4e4ba87f80a002452a527527866322af7ccea7f23f366735e46df989","url":"https://data.mgh.de/openmgh/bsb00000829.zip"}
