{"acquisition_id":"gerhoh-princeps-mundi-huius-iam-iudicatus-openmgh-acquired","edition_id":"gerhoh-princeps-mundi-huius-iam-iudicatus-openmgh-electronic","provider":"Monumenta Germaniae Historica (openMGH)","retained_files":[{"bytes":1183639,"media_type":"application/zip","path":"raw/openmgh/bsb00000830/bsb00000830.zip","scope":"Original complete acquired openMGH archive.","sha256":"3cc84719875aec1c7a3bceb9cb754f55d191705bce73f628f93135bad6e8f1e5"},{"bytes":4131626,"media_type":"application/tei+xml","path":"raw/openmgh/bsb00000830/tei/bsb00000830.xml","scope":"Extracted TEI XML raw/openmgh/bsb00000830/tei/bsb00000830.xml is the retained text source; ZIP raw/openmgh/bsb00000830/bsb00000830.zip is the acquisition package. existing work association locators: raw/openmgh/bsb00000830/tei/bsb00000830.xml#bsb00000830_00247_37; raw/openmgh/bsb00000830/tei/bsb00000830.xml#bsb00000830_00280_46. These locators are evidence for accounting, not an adopted complete child extraction or TEI acceptance.","sha256":"bb97bf6037a31d6a6c37f0e967aa23e9df1933bdd688fe4aaa84e5e034ff67ac"}],"schema_version":"2.0","source_bytes":4131626,"source_path":"raw/openmgh/bsb00000830/tei/bsb00000830.xml","source_scope":"Extracted TEI XML raw/openmgh/bsb00000830/tei/bsb00000830.xml is the retained text source; ZIP raw/openmgh/bsb00000830/bsb00000830.zip is the acquisition package. existing work association locators: raw/openmgh/bsb00000830/tei/bsb00000830.xml#bsb00000830_00247_37; raw/openmgh/bsb00000830/tei/bsb00000830.xml#bsb00000830_00280_46. These locators are evidence for accounting, not an adopted complete child extraction or TEI acceptance.","source_sha256":"bb97bf6037a31d6a6c37f0e967aa23e9df1933bdd688fe4aaa84e5e034ff67ac","url":"https://data.mgh.de/openmgh/bsb00000830.zip"}
